{
  "schema_version": 1,
  "script": "collect_linux_crash_info.sh",
  "script_version": "1.1.0",
  "platform": "linux",
  "collected_at": "2026-05-26T02:00:00Z",
  "service": "your-app.service",
  "process": "YourApp",
  "hours": "24",
  "redacted": true,
  "zip_requested": true,
  "warnings": ["dmesg query failed; root or CAP_SYSLOG may be required"],
  "warnings_file": "collection-warnings.txt",
  "warnings_count": 1,
  "files": [
    {
      "path": "summary.txt",
      "bytes": 96,
      "sha256": "abcdefabcdefabcdefabcdefabcdefabcdefabcdefabcdefabcdefabcdefabcd"
    }
  ]
}
